{
  "schema_version": 1,
  "fixture_id": "osc-chat-reply-duplicate-headers",
  "recorded_at": "2026-07-14T03:00:00Z",
  "route": {
    "service": "5002",
    "rule": "/api/osc/chat",
    "methods": ["POST"],
    "endpoint": "web_runtime.osc_chat_api"
  },
  "request": {
    "method": "POST",
    "path": "/api/osc/chat",
    "query": {},
    "headers": {
      "Authorization": "<redacted:authorization:16ef89c38ee1>",
      "Content-Type": "application/json"
    },
    "content_type": "application/json",
    "body": {
      "message": "檢查重複回應標頭",
      "session_id": "<redacted:session_id:a43d75aff0b8>"
    },
    "files": []
  },
  "response": {
    "status": 200,
    "headers": [
      {"header": "Content-Type", "value": "application/json"},
      {"header": "Set-Cookie", "value": "<redacted:set-cookie:111111111111>"},
      {"header": "Set-Cookie", "value": "<redacted:set-cookie:222222222222>"}
    ],
    "content_type": "application/json",
    "body": {"reply": "duplicate headers preserved", "degraded": false}
  },
  "side_effect_class": "reversible_write",
  "expected_legacy_shape": "reply_json",
  "redaction": {
    "version": 1,
    "safe_for_offline": true,
    "raw_payload_retained": false,
    "test_payload_only": false,
    "applied": ["key:authorization", "key:session_id", "key:set-cookie"]
  },
  "replay": {
    "mode": "offline",
    "network_allowed": false,
    "external_writes_allowed": false
  }
}
